{"algorithm":"Ed25519","issuer":"urn:aigc-proof:official:independent-ap035","key_id":"independent-ap035-key","profile":"aigc-proof.official-issuer-trust.v1","public_key_b64":"GX9rI+FshTLGq8g4+s1ep4m+DHaykgM0A5v6iz02jWE=","sequence":4,"status":"active","valid_from":1799996400,"valid_until":1800007200}
