{"algorithm":"Ed25519","issuer":"urn:aigc-proof:official:local-phase1","key_id":"phase1-751d6d87946c9df7d28360c1","profile":"aigc-proof.official-issuer-trust.v1","public_key_b64":"SetoaAxnLhMqx8eyR7vT/oyl7I+qWHbpirm2xHFDSQo=","sequence":1,"status":"active","valid_from":1784173397,"valid_until":1784259857}
